title,description,link,query,date,published,source
트럼프 “이란과 생산적 대화”…전쟁 완화 기대에 뉴욕증시 급등,도널드 트럼프 미국 대통령이 이란과의 대화를 언급하며 군사 행동을 보류하자 뉴욕증시가 상승 마감했다. 23일(현지시간) 뉴욕증시에서 다우존스30 산업평균지수는 전 거래일보다 631.00포인트 오른 46208.47에 거래를 마쳤다. 스탠더드앤드푸어스 500 지수는 74.,https://www.etnews.com/20260324000012,AI/인공지능,2026-03-24,"Tue, 24 Mar 2026 08:02:14 +0900",오늘의 추천기사 - 이티뉴스
"업스테이지, 에이전트 AI 특화 ‘솔라 프로 3’ 공개...""추론 능력 강화""","업스테이지(대표 김성훈)가 자체 개발 대형언어모델(LLM) ‘솔라 프로 3’를 24일 공개했다.업스테이지는 최근 AI 경쟁의 중심이 단순 모델 성능을 넘어 실제 업무를 수행하는 에이전트형 AI로 이동하고 있다고 전했다. '솔라 프로 3'는 이러한 흐름에 답하는 모델이라고 강조했다. 기존 ‘솔라 프로 2’ 대비 3배 이상 커진 1020억 매개변수(102B)의 대형 모델임에도, 비용과 처리 속도(TPS)는 동일하게 유지해 효율성을 높였다는 설명이다.성능 면에서는 다단계 작업을 수행하는 도구 호출, 복합 지시 이행 등 에이전트 워크플로우",https://www.aitimes.com/news/articleView.html?idxno=208250,AI/인공지능,2026-03-24,2026-03-24 09:04:39,AI타임스 - 전체기사
"""꽃길만 걷게 해줄게""… 순천 도시 전역 ‘봄 여행 축제’ 개막","순천시가 꽃과 정원, 체험형 콘텐츠를 묶어 본격적인 봄철 관광객 맞이에 나선다. 순천은 순천만국가정원과 동천 벚꽃길, 선암사, 낙안읍성, 드라마촬영장 등 도시 전역을 잇는 봄 여행 콘텐츠를 마련해 여행객을 맞이할 예정이라고 23일 밝혔다.홍매화로 시작해 벚꽃과 튤립, 철쭉, 장미로 이어지는 계절 동선을 앞세워 걷고 머물고 쉬는 여행지 이미지를 강화하겠다는 구상이다. 봄꽃 경관에 웰니스와 레트로 체험 프로그램을 결합한 관광 콘텐츠 운영도 포함됐다.3월 초에는 탐매마을의 홍매화와 매산등 근대문화유산 거리 산책길이 먼저 봄을 열고, 도심",https://www.aitimes.com/news/articleView.html?idxno=208246,AI/인공지능,2026-03-24,2026-03-24 08:58:09,AI타임스 - 전체기사
"전남광주, '20조 설계도' 시·도민 손에 맡긴다","전라남도는 오는 28일 오후 2시 장성문화예술회관에서 ‘전남 청책대동회 바란’을 열고, 전남광주통합특별시 출범과 함께 정부가 약속한 20조원 규모 재정의 활용 방안을 시·도민과 함께 논의한다고 23일 밝혔다.행사는 통합특별시 출범 이후 재정 우선순위를 어떻게 짤지 주민 참여 방식으로 설계하는 자리라는 점이 강조됐다. 전남은 단순한 의견 수렴을 넘어 시·도민이 직접 재정 설계에 참여하는 구조라고 전했다.분야별 전문가 발제와 사전 제안자 발언, 현장 자유토론이 이어질 예정이다. 정책 방향을 행정 내부가 아닌 공개 숙의 구조에서 끌어내겠",https://www.aitimes.com/news/articleView.html?idxno=208245,AI/인공지능,2026-03-24,2026-03-24 08:57:27,AI타임스 - 전체기사
[3월23일] 엔비디아가 '에이전트'를 로봇 AI의 미래라고 강조한 이유,"엔비디아가 지난주 'GTC'에서 쏟아낸 굵직한 소식에 가려, 별로 주목받지 못했던 부분이 많습니다. 그중 하나가 바로 로봇과 에이전트의 연계입니다.행사장에서는 젠슨 황 CEO가 '겨울 왕국'의 올라프 로봇과 이야기를 나눈 이벤트가 돋보였지만, 이날 그는 에이전트가 피지컬 AI와 로봇 AI의 핵심 역할을 할 것이라고 강조했습니다. 그는 별도의 기자회견에서도 ""몇년 안에 로봇 내부에서 오픈클로가 실행될 것이라는 점은 꽤 확실하다""라고 말했습니다.디푸 탈라 엔비디아 로봇 및 엣지 AI 담당 부사장은 디 인포메이션과의 인터뷰를 통해 이에",https://www.aitimes.com/news/articleView.html?idxno=208206,AI/인공지능,2026-03-24,2026-03-24 07:00:00,AI타임스 - 전체기사
치료 어려웠던 반려견의 암… ‘챗GPT’로 약 개발에 성공했다?,AI타임스 조예주 기자 joyejuoffice@aitimes.com,https://www.aitimes.com/news/articleView.html?idxno=208233,AI/인공지능,2026-03-24,2026-03-24 06:55:00,AI타임스 - 전체기사
"앤트로픽 ""AI 사용자, 일자리보다 환각에 더 큰 우려""","앤트로픽의 대규모 조사 결과, AI에 대한 사용자의 가장 큰 우려가 일자리 대체가 아니라 오류와 환각 문제라는 점이 확인됐다.앤트로픽은 19일(현지시간) 전 세계 8만명 이상과의 인터뷰를 바탕으로 사람들이 AI를 어떻게 사용하고 있는지를 분석한 연구 결과를 발표했다.이번 연구는 AI 챗봇 클로드를 활용한 ‘앤트로픽 인터뷰어(Anthropic Interviewer)’를 통해 진행됐다. 총 70개 언어로 수집된 8만508명의 응답은 AI가 수행한 인터뷰와 분석을 통해 분류됐으며, 이는 역대 최대 규모의 정성적 AI 사용자 조사로 평가된",https://www.aitimes.com/news/articleView.html?idxno=208205,AI/인공지능,2026-03-24,2026-03-23 18:59:48,AI타임스 - 전체기사
"보성 오봉산 생태탐방로 아트월, 자연과 구들장의 시간을 새기다","전남 보성군 오봉산 생태탐방로에 지역의 자연환경과 구들장 채석 문화의 역사를 함께 담아낸 아트월이 조성되어 탐방객들의 관심을 모으고 있다. 이번 공간은 국가중요민속문화재로 지정된 오봉산 구들장 채석지의 의미를 시각적으로 전달하고, 자연 속에서 지역의 이야기를 경험할 수 있도록 계획된 것이 특징이다.아트월은 석재의 색상 대비를 통해 산 능선과 지층의 흐름을 시각적으로 표현했다. 곡선형 그래픽 구성은 채석 작업의 과정과 자연의 시간성을 상징적으로 연결하며, 채석 과정과 운반 도구, 유통 구조 등 구들장 생산과 관련된 다양한 정보를 사진",https://www.aitimes.com/news/articleView.html?idxno=208244,AI/인공지능,2026-03-24,2026-03-23 18:30:00,AI타임스 - 전체기사
"알트먼의 ""엔지니어 감사"" 글에 비아냥 폭주","AI 확산으로 글로벌 빅테크 기업들이 대규모 감원을 단행하는 가운데, 샘 알트먼 오픈AI CEO의 최근 발언이 개발자 커뮤니티의 거센 반발을 불러일으키고 있다.알트먼 CEO는 18일(현지시간) X에 “복잡한 소프트웨어를 한줄 한줄 작성해 온 개발자들에게 깊이 감사한다”라며 “그 노력이 얼마나 컸는지 이제는 잊기 어려울 정도”라는 글을 남겼다.이는 올해 출시한 'GPT-5.3-코덱스'와 'GPT-5.4'의 코딩 성능 향상으로, 오픈AI의 기업 시장 점유율이 높아진 데에 따른 감사의 표시다. 하지만, 이 발언은 오히려 AI로 인한 일자",https://www.aitimes.com/news/articleView.html?idxno=208232,AI/인공지능,2026-03-24,2026-03-23 18:28:36,AI타임스 - 전체기사
AI 사용 의혹으로 공포 소설 '샤이 걸' 출판 취소,"미국 대형 출판사 아셰트 북 그룹이 AI 사용 의혹이 제기된 소설의 출간을 전격 취소하면서, 출판 업계에 AI 활용을 둘러싼 논쟁이 확산하고 있다.19일(현지시간) 뉴욕타임스에 따르면, 이번 논란은 작가 미아 발라드의 공포 소설 ‘샤이 걸(Shy Girl)’을 둘러싸고 불거졌다.이 작품은 온라인에서 “AI로 작성된 것 아니냐”는 의혹이 제기된 이후 논란이 커졌고, 결국 출판사는 내부 검토를 거쳐 출간을 중단하기로 결정했다. 책은 미국 출시를 앞두고 있었으며, 이미 영국에서는 일부 판매된 상태였다.출판사는 “독창적인 창작과 스토리텔링",https://www.aitimes.com/news/articleView.html?idxno=208234,AI/인공지능,2026-03-24,2026-03-23 18:00:00,AI타임스 - 전체기사
"AI 모델에 ""의식이 있다""라고 학습했더니","AI 모델에 '의식이 있다'라고 주장하도록 학습하면, 어떤 일이 일어나는지를 연구한 결과가 공개됐다. 학습에 따라 모델이 의식이 있다고 주장하는 것은 당연하지만, 이에 따라 모델의 전반적인 선호도 인간처럼 변하는 것으로 확인됐다.비영리 단체인 트루스풀 AI(Truthful AI)와 앤트로픽은 19일(현지시간) '의식 클러스터: 스스로 의식이 있다고 주장하는 모델들의 선호도'라는 논문을 발표했다.대부분 대형언어모델(LLM)은 의식이나 감정이 없다고 주장한다. 연구에서는 오픈AI의 'GPT-4.1'이 대표적으로 꼽혔다. 반면, 앤트로픽",https://www.aitimes.com/news/articleView.html?idxno=208229,AI/인공지능,2026-03-24,2026-03-23 18:00:00,AI타임스 - 전체기사
"PwC ""AI에 저항하는 직원은 회사에 있을 자격 없어""","글로벌 회계·컨설팅 기업 PwC가 AI 시대에 대응해 조직과 비즈니스 모델을 전면 재편한다. AI 도입에 소극적인 인력은 도태될 수 있다는 강경한 메시지와 함께, 시간당 과금 중심의 기존 수익 구조도 대대적으로 바꾸겠다는 방침이다.파이낸셜 타임스에 따르면, 폴 그릭스 PwC 미국 CEO는 19일(현지시간) “AI를 중심에 두지 않는 인력은 오래 남기 어렵다”라며 “AI 도입을 선택 사항으로 여기는 사람은 조직에 설 자리가 없다”라고 밝혔다.이는 AI 확산이 전문 서비스 업계의 근간을 뒤흔들 수 있다는 위기의식에서 나온 발언으로 해석",https://www.aitimes.com/news/articleView.html?idxno=208223,AI/인공지능,2026-03-24,2026-03-23 18:00:00,AI타임스 - 전체기사
"오픈AI ""AI 연구원이 '북극성'...2100조 투자로 30GW 컴퓨팅 투입""","오픈AI가 인간 없이 과학 문제를 해결하는 ‘AI 연구원(AI Researcher)’ 개발을 앞으로 몇년 간 회사의 최우선 순위 프로젝트라고 강조했다. 이를 위해 엄청난 자본을 투자할 예정이라고 밝혔다.야쿠부 파초키 오픈AI 수석 과학자는 20일(현지시간) MIT 테크놀로지 리뷰와의 인터뷰를 통해 AI 연구원을 앞으로 최우선 순위(North Star) 프로젝트로 설정했다고 말했다.이를 위해 추론 모델과 자율 에이전트, 해석 가능성 기술을 통합해 완전 자동화 연구 시스템을 구축할 계획이다.이미 공개한 것처럼 올해 안으로 ‘자율 AI",https://www.aitimes.com/news/articleView.html?idxno=208220,AI/인공지능,2026-03-24,2026-03-23 18:00:00,AI타임스 - 전체기사
물리적 세계 이해하는 '월드 모델'의 세가지 방식은,"벤처비트는 20일(현지시간) 차세대 AI 핵심 인프라로 꼽히는 월드 모델을 크게 3가지 방식으로 구분해 소개했다.첫번째 방식은 픽셀 수준에서 세계의 동역학을 직접 예측하려 하기보다, ‘잠재 표현(latent representation)’을 학습하는 데 초점을 맞춘다. 얀 르쿤이 설립한 AMI 랩스의 'JEPA'가 대표적이다.JEPA 모델은 사람이 세상을 이해하는 방식을 모방하려는 기술이다. 사람은 장면을 볼 때 모든 픽셀이나 세세한 요소를 다 기억하지 않고, 중요한 부분만 파악한다. 도로를 달리는 자동차를 보면 나뭇잎에 비친 빛까지",https://www.aitimes.com/news/articleView.html?idxno=208211,AI/인공지능,2026-03-24,2026-03-23 18:00:00,AI타임스 - 전체기사
"""오픈클로 에이전트들의 활동을 3D 사무실로 표현""...가상 공간 '클로3D' 공개","AI 에이전트의 활동을 시각화한 가상 공간이 등장했다. 텍스트 로그 뒤에 숨겨져 있던 작업 과정을 3D 공간에서 표현, AI의 활동을 직접 보고 이해하는 ‘시각화된 업무 환경’ 시대가 열리고 있다.개발자 루크더데브(LukeTheDev)는 최근 오픈클로(OpenClaw) 에이전트들의 활동을 가상 사무실 형태로 구현한 프로젝트 ‘클로3D(Claw3D)’를 공개했다.클로3D는 오픈클로 프로젝트와는 별개의 독립 커뮤니티 프로젝트로, 깃허브를 통해 오픈소스로 공개된다.AI 자동화 작업을 3D 환경으로 시각화한 것이다. 수십개의 에이전트가 사",https://www.aitimes.com/news/articleView.html?idxno=208203,AI/인공지능,2026-03-24,2026-03-23 18:00:00,AI타임스 - 전체기사
"삼성SDS, 국내 첫 'B300' GPU 서비스 출시…”GPU 8장 시간 당 14만원에 제공”","삼성SDS는 국내 최초로 엔비디아 최신 GPU 블랙웰 울트라 'B300'를 탑재한 GPU 구독형 서비스(GPUaaS)를 출시했다고 23일 밝혔다.클라우드 'SCP(삼성 클라우드 플랫폼)'을 통해 서비스한다. 이를 통해 기업들의 AI 추론용 고성능 컴퓨팅 수요에 대응한다는 전략이다. 특히, 고용량 메모리를 통해 AI 모델을 효율적으로 처리할 수 있어 AI 에이전트, 이미지와 영상, 코드 생성 및 분석 등 고성능이 필요한 AI 서비스의 지연 시간을 최소화할 수 있다고 강조했다. 필요한 만큼 쓰고 지불하는 구독형 모델로, 초기 투자 리스",https://www.aitimes.com/news/articleView.html?idxno=208237,AI/인공지능,2026-03-24,2026-03-23 17:50:28,AI타임스 - 전체기사
"[게시판] 포자랩스, AI 영상 편집 툴 ‘브루’에 AI 생성 음원 제공 등 단신","■ 포자랩스(대표 허원길)는 AI 생성 음악 500곡을 보이저엑스의 영상 편집 툴 ‘브루(Vrew)’에 제공했다고 밝혔다. 브루는 AI 자막 생성과 편집 기능을 중심으로 영상 제작을 지원하는 영상 편집 프로그램으로, 다양한 크리에이터들이 콘텐츠 제작 과정에서 활용하고 있는 툴이다. 이번에 제공된 음원은 EDM, 힙합, 락, 펑크, 뉴에이지, 재즈, 시네마틱 등 장르로 구성돼 있으며, 브루 이용자들은 영상 편집 과정에서 해당 음악을 자유롭게 선택해 사용할 수 있다.■ 파네시아는 링크반도체 기술을 바탕으로 AX 혁신을 실현하고자 한국과",https://www.aitimes.com/news/articleView.html?idxno=208243,AI/인공지능,2026-03-24,2026-03-23 17:50:00,AI타임스 - 전체기사
"파수 미국 법인, AI 기업 컨실릭스와 합병…”글로벌 AI 전문으로 출범”","AX 전문 파수(대표 조규곤)는 미국 법인을 현지 전문기업과 합병하고 글로벌 AI 시장 진출을 본격화한다고 23일 밝혔다.파수 미국 법인은 미국의 AI 플랫폼 및 컨설팅 전문 컨실릭스와 합병을 진행, 기업용 AI 전문 기업으로서 심볼로직(Symbologic)을 새롭게 출범한다고 23일 밝혔다. 파수 미국 법인과 합병을 진행하는 컨실릭스는 PwC, 아마존웹서비스(AWS), 구글 클라우드 등을 거친 기업용 AI 전문가 롭 마라노를 중심으로 설립된 기업용 AI 플랫폼 및 컨설팅 전문 기업이다. 설립자뿐만 아니라 임직원 모두 구글, 아마존",https://www.aitimes.com/news/articleView.html?idxno=208241,AI/인공지능,2026-03-24,2026-03-23 17:50:00,AI타임스 - 전체기사
"[게시판] 셀바스AI·메디아나·이지케어텍, AI 스마트병동 공동 개발 등 단신","■ 셀바스AI(대표 곽민철)는 메디아나, 이지케어텍과 AI 스마트 병동 통합 솔루션 공동 개발을 위한 협약을 체결했다고 밝혔다. AI와 환자감시장치, 전자의무기록(EMR)을 통합한 스마트 병동 솔루션의 공동 개발과 사업화를 추진한다. 3사의 핵심 기술을 결합해 ▲환자감시장치 데이터의 EMR 실시간 연동 ▲AI 환자 상태 분석 및 조기경보(EWS) 시스템 개발 ▲음성인식 기반 의료기록 자동화 등을 진행한다.■ 예진(대표 고종현)의 AI 기업용 플랫폼 ‘젤리아이’가 과학기술정보통신부와 정보통신산업진흥원(NIPA)이 추진하는 ‘AI 바우",https://www.aitimes.com/news/articleView.html?idxno=208228,AI/인공지능,2026-03-24,2026-03-23 17:50:00,AI타임스 - 전체기사
"데이원컴퍼니, 신해동·김동혁 공동대표 선임…”이강민 전 대표 CAIO 전환”","교육 콘텐츠 전문 데이원컴퍼니는 신해동, 김동혁 두 임원을 대표이사로 선임하고 공동대표 체제로 전환한다고 23일 밝혔다.데이원컴퍼니는 지난 20일 이사회를 통해 신해동 전 패스트캠퍼스 총괄 대표와 김동혁 전 콜로소 부문 대표를 신임 공동대표로 선임했다. 창립 초기부터 회사를 성장시켜 온 두 내부 경영진이 공동대표를 맡게 되면서, 회사의 정체성과 성장 흐름을 가장 잘 이해하는 리더십 체제를 구축했다는 설명이다.이번 공동대표 체제 전환은 데이원컴퍼니의 조직·사업·기술 전반에 걸친 총체적 변화를 추진하기 위한 전략적 결정이다. 두 대표는",https://www.aitimes.com/news/articleView.html?idxno=208240,AI/인공지능,2026-03-24,2026-03-23 17:41:11,AI타임스 - 전체기사
"정부, 중·저준위 방폐물 관리체계 전면 개편… 2030년까지 5577억 투입","정부가 중·저준위 방사성폐기물 관리체계를 다시 짰다. 제12차 원자력진흥위원회는 3월9일부터 12일까지 서면으로 열려 제3차 중·저준위 방사성폐기물 관리 기본계획을 심의·의결했다고 23일 밝혔다.이번 계획은 30년을 계획기간으로 5년마다 수립하는 법정계획으로, 향후 마련될 제3차 고준위 방사성폐기물 관리 기본계획과 연계해 방사성폐기물을 안전하고 효율적으로 관리하는 중장기 정책의 성격을 띤다. 정부는 이번 계획에서 안전하고 효율적인 관리시스템 고도화, 미래 대비 방폐물 관리기반 구축, 국민 신뢰에 기반한 방폐물 관리 등 3대 축 아래",https://www.aitimes.com/news/articleView.html?idxno=208239,AI/인공지능,2026-03-24,2026-03-23 17:40:00,AI타임스 - 전체기사
