title,description,link,query,date,published,source
"경찰, ‘3명 사망’ 영덕 풍력발전기 화재 관련 수사 착수···‘업무상과실치사’ 적용 검토",경북 영덕군 영덕읍 풍력발전단지의 한 풍력발전기에서 지난 23일 불이 나 연기가 피어오르고 있다. 연합뉴스노동자 3명이 숨진 경북 영덕 풍력발전단지 화재와 관련해 경찰이 수사에 착수했다.경북경찰청은 이번 사고의 원인과 책임 소재 등을 가리기 위한 절차에 나섰다고 24일 밝혔다. 경찰은 사고 당시 현장 상황과 작업 내용 등을 확인해 업체 관계자들의 과실 여부···,https://www.khan.co.kr/article/202603240912001/?utm_source=khan_rss&utm_medium=rss&utm_campaign=society_news,사회,2026-03-24,2026-03-24T09:12:00+09:00,경향신문:사회
[점선면]‘산재와의 전쟁’ 선포에도…안전공업 참사 왜 못 막았나,"점(사실들): 14명 목숨 앗아갔다선(맥락들): “기름 뚝뚝 떨어질 정도였다”면(관점들): ‘아리셀 참사’와는 또 다른 점14명의 사망자가 발생한 대전 안전공업 화재 참사 현장에서 지난 23일 경찰과 소방, 국립과학수사원, 고용노동부 등 관계자들이 합동 감식을 진행하고 있다. 대전|문재원 기자또 대형 참사입니다. 대전 자동차 부품 제조업체 안전공업 공장에서···",https://www.khan.co.kr/article/202603240700011/?utm_source=khan_rss&utm_medium=rss&utm_campaign=society_news,사회,2026-03-24,2026-03-24T07:00:01+09:00,경향신문:사회
"대형 회계법인서 잇단 사망 왜···회사는 AI 핑계, 극한 과로 내몰리는 회계사들","회계사. AI생성 이미지AI가 제역할 못해서? AI로 채용 줄여서?연이은 사망에 동료들 “그것만은 아닌데…”AI 정보 재검증하느라 되레 업무 늘어“내년 감사 시즌엔 다 쓰러질 듯”“실체도 없는 인공지능(AI) 때문에 사람 죽어나가는 거예요. 경영진은 유명무실한 AI 써서 추가 채용도 없고, 오히려 인원 투입 줄이라고 압박이나 넣는 상황입니다.”23일 직장인···",https://www.khan.co.kr/article/202603240600041/?utm_source=khan_rss&utm_medium=rss&utm_campaign=society_news,사회,2026-03-24,2026-03-24T06:00:04+09:00,경향신문:사회
"[단독]‘불법 촬영·성희롱 논란’ 자유대학 대표, 정통망법 위반 혐의 고발당해","김진일 자유와혁신 최고위원이 자신의 SNS에 올린 글. 스레드 캡처불법 촬영과 성희롱 논란으로 내홍을 겪고 있는 극우단체 자유대학의 박준영 대표가 고발을 당했다. 단체 대화방에서 오간 성희롱성 발언 등을 방치한 혐의다.23일 경향신문 취재를 종합하면, 서울 영등포경찰서는 지난 20일 박 대표에 대한 정보통신망법 위반 혐의 고발장을 접수했다.앞서 김진일 자유···",https://www.khan.co.kr/article/202603240600011/?utm_source=khan_rss&utm_medium=rss&utm_campaign=society_news,사회,2026-03-24,2026-03-24T06:00:01+09:00,경향신문:사회
‘고교 동문 변호사 사건들 감형’ 현직 부장판사 구속영장 기각,"법원 로고. 한수빈 기자전주지법 근무당시 20여건, 1심보다 가벼운 형 선고돌반지 등 금품 수수···아내 교습소 무상임차 의혹선물 대가성 등 관련 혐의 부인···법원 “소명 부족”고교 동문 변호사로부터 금품을 받고 해당 변호사가 맡은 사건 형량을 깎아준 혐의를 받는 현직 부장판사에 대한 구속영장 청구를 법원이 23일 기각했다.서울중앙지법 김진만 영장전담 부···",https://www.khan.co.kr/article/202603232321001/?utm_source=khan_rss&utm_medium=rss&utm_campaign=society_news,사회,2026-03-24,2026-03-23T23:21:00+09:00,경향신문:사회
KB국민은행 “AI로 인력 투입 줄면 사업비 변경”…IT서비스 업계 AI 發 대격변 예고,"대형 차세대 정보통신(IT)서비스 구축 사업에서 인공지능(AI) 기술을 활용해 인건비 등을 절감하면 이에 따른 사업비를 조정하는 조항이 등장했다. 기존에는 프로젝트 투입 인원수와 기간을 기준으로 사업비를 산정했는데, AI 도입이 확산됨에 따라 사업비 책정 등 IT 개발",https://www.etnews.com/20260320000240,IT/과학,2026-03-24,"Sun, 22 Mar 2026 16:00:00 +0900",오늘의 인기기사 - 이티뉴스
"삼성전자, HBM4 품질 더 높인다…웨이퍼 절단 공정 차세대 전환",삼성전자가 반도체 품질·수율과 직결되는 웨이퍼 절단 공정을 차세대 방식으로 전환한다. 고대역폭메모리(HBM)4를 대상으로 지난해 처음 도입합 '펨토초(1000조분의 1초) 레이저' 공정을 확대 적용한다. 절단 정밀도를 대폭 끌어올린 기술로 HBM4 시장 주도권을 쥐려는,https://www.etnews.com/20260323000273,IT/과학,2026-03-24,"Mon, 23 Mar 2026 16:01:00 +0900",오늘의 인기기사 - 이티뉴스
李대통령 지지율 67% '최고치' 경신…민주 46%·국힘 20%,"이재명 대통령의 국정 지지율이 3주 연속 취임 후 최고치를 기록했다는 여론조사 결과가 나왔다. 20일 한국갤럽은 지난 17∼19일 전국 만 18세 이상 1004명을 대상으로 조사한 결과, 이 대통령의 직무수행에 관한 긍정 평가가 직전 조사보다 1%포인트(p) 오른 67",https://www.etnews.com/20260320000266,IT/과학,2026-03-24,"Fri, 20 Mar 2026 15:54:50 +0900",오늘의 인기기사 - 이티뉴스
삼성전자 갤럭시S26에 '에어드롭' 지원…애플 생태계 격차 줄인다,삼성전자가 갤럭시S26 시리즈를 시작으로 애플 파일 공유 기능 '에어드롭(AirDrop)'을 연동한다.,https://www.etnews.com/20260323000312,IT/과학,2026-03-24,"Mon, 23 Mar 2026 14:02:44 +0900",오늘의 인기기사 - 이티뉴스
"코스피, 하루 만에 '반등'…조기 종전 기대감 반영",트럼프의 '확전 자제' 발언이 나오자 코스피가 하루 만에 다시 반등해 5800대를 회복했다. 20일 한국거래소에 따르면 이날 코스피는 0.31%(17.98P) 오른 5781.20에 장을 마쳤다. 장중에는 5833.68을 기록하며 상승세를 보였다. 코스피 시장에서 개인,https://www.etnews.com/20260320000260,IT/과학,2026-03-24,"Fri, 20 Mar 2026 15:41:01 +0900",오늘의 인기기사 - 이티뉴스
"[단독] 금감원, 보험사에 '백내장 실손보험금' 민원 재검토하라",일단락된 줄 알았던 백내장 실손보험금 미지급 사태가 반전되는 분위기다. 금융감독원이 보험사들을 소집해 보험금 지급을 재검토할 것을 요청하면서 보험업계가 패닉에 빠졌다. 23일 보험업계에 따르면 이달 금융감독원은 생명·손해보험사 보상 담당 부서장 및 담당자들을 소집해 각,https://www.etnews.com/20260323000183,IT/과학,2026-03-24,"Mon, 23 Mar 2026 13:00:00 +0900",오늘의 인기기사 - 이티뉴스
"갤S26, 에어드롭 지원... 아이폰과 파일 공유 가능","삼성전자가 갤럭시S26 시리즈에 애플 파일 공유 기능 '에어드롭(AirDrop)' 연동 기능을 도입한다. 애플 글로벌 경쟁사인 삼성전자 스마트폰에 이 기능이 탑재되는 것은 이번이 처음이다. 삼성전자는 23일 한국을 시작으로 갤럭시S26, 갤럭시S26+, 갤럭시S26 울",https://www.etnews.com/20260323000037,IT/과학,2026-03-24,"Mon, 23 Mar 2026 09:11:12 +0900",오늘의 인기기사 - 이티뉴스
"삼성D, 8.6세대 OLED 개발 순항…예상 수율 70% 넘어서",삼성디스플레이가 디스플레이 생산성을 혁신할 게임체인저 기술 '8.6세대 유기발광다이오드(OLED)' 예상 수율을 70% 이상으로 끌어올렸다. 준비가 순조롭게 진행된다는 의미로 6~7월로 임박한 양산을 안정적으로 소화할 전망이다. 22일 업계에 따르면 삼성디스플레이는 충,https://www.etnews.com/20260320000232,IT/과학,2026-03-24,"Sun, 22 Mar 2026 16:00:00 +0900",오늘의 인기기사 - 이티뉴스
여수는 통합·울산은 난항…석화 사업재편 온도차,"롯데케미칼과 여천NCC 공장 통합, 다운스트림 효율화를 골자로 한 여수 1호 프로젝트 사업재편계획서 최종안이 정부에 제출됐다. 대산에 이어 여수까지 사업재편이 속도를 내는 가운데 울산은 업체 간 이견으로 제자리걸음을 이어가고 있다. 관련 업계에 따르면 여천NCC, DL",https://www.etnews.com/20260320000184,IT/과학,2026-03-24,"Sat, 21 Mar 2026 12:00:00 +0900",오늘의 인기기사 - 이티뉴스
"전북대-성균관대, 꿈의 신소재 '맥신' 성능 세계 최고 수준 제조 기술 개발",전북대학교는 권한중 신소재공학부 교수가 구종민 성균관대학교 신소재공학부 교수로 구성한 공동 연구팀이 첨단 전자기기 등이 폭넓게 활용될 수 있는 차세대 신소재인 '맥신(MXene)의 성능을 획기적으로 높일 수 있는 연구 성과를 발표해 주목을 받고 있다고 21일 밝혔다.,https://www.etnews.com/20260320000295,IT/과학,2026-03-24,"Sat, 21 Mar 2026 09:30:00 +0900",오늘의 인기기사 - 이티뉴스
호르무즈 묶였는데 비축유 90만배럴 '증발'…정부 “정유사 수출제한 검토”,"국가 비상사태를 대비해 보관 중이던 국제공동비축 원유 90만배럴이 한국석유공사의 늑장 대응으로 해외로 팔려나갔다. 정부는 석유공사에 대한 긴급 감사에 착수하는 한편, 국내 기름값 인상을 기정사실화하고 정유사 수출제한 조치까지 검토하는 등 전방위 비상 대응에 나섰다. 2",https://www.etnews.com/20260322000099,IT/과학,2026-03-24,"Sun, 22 Mar 2026 12:13:02 +0900",오늘의 인기기사 - 이티뉴스
[오늘의 운세] 2026년 3월 22일 띠별 운세,[ 쥐띠 ] 달이 먹구름 속으로 들어가니 그 빛을 볼 수가 없습니다.  48년생 : 위아래 사람이 화목하지 못하니 분수를 지키는 것이 상책입니다. 60년생 : 친구에게 도움을 청하면 고민하는 일이 해결 될 수 있을,https://www.etnews.com/20260322000023,IT/과학,2026-03-24,"Sun, 22 Mar 2026 09:16:49 +0900",오늘의 인기기사 - 이티뉴스
"머스크, 오스틴에 AI 칩 생산시설 '테라팹' 건설... 테슬라·스페이스X 공동 운영","일론 머스크 테슬라 최고경영자(CEO)가 로봇공학, 인공지능(AI), 우주 데이터 센터용 칩을 자체 생산하기 위한 '테라팹' 프로젝트를 오스틴에 건설할 것이라고 밝혔다. 블룸버그 통신은 머스크가 21일(현지시간) 미국 텍사스주 오스틴의 한 행사장에서 테슬라와 스페이스X",https://www.etnews.com/20260323000008,IT/과학,2026-03-24,"Mon, 23 Mar 2026 06:52:55 +0900",오늘의 인기기사 - 이티뉴스
3G 트래픽 첫 10TB대 진입…자원 효율 위한 셧다운 논의 가속,국내 3세대(3G) 이동통신 월간 데이터 트래픽이 사상 처음 20테라바이트(TB) 아래로 떨어졌다. 망 유지에 따른 전력 낭비와 재난문자 수신 불가 등 안전 리스크까지 부각되면서 올해 3G 조기 종료 논의가 빨라질 전망이다. 23일 과학기술정보통신부 무선 통계에 따르면,https://www.etnews.com/20260323000364,IT/과학,2026-03-24,"Mon, 23 Mar 2026 16:00:00 +0900",오늘의 인기기사 - 이티뉴스
“노벨상 첫 도전” HFSP에 한국 연구자 7명 선정,세계 최고 생명과학 연구지원 프로그램인 '휴먼프론티어사이언스프로그램(HFSP)'에 한국 연구자가 대거 선정됐다. 노벨상 다수 배출로 이른바 '노벨상 펀드'로도 불리는 프로그램 참여에 따라 한국 첫 노벨상 수상자 탄생 가능성에 이목이 집중된다. 과학기술정보통신부는 202,https://www.etnews.com/20260320000278,IT/과학,2026-03-24,"Sun, 22 Mar 2026 16:00:00 +0900",오늘의 인기기사 - 이티뉴스
美 여론 “이란 전쟁 반대 60%”…'현 정권 유지 종전'은 과반 반대,미국 내 최신 여론조사에서 도널드 트럼프 미국 대통령이 결정한 대이란 전쟁에 대해 부정적인 여론이 여전히 우세한 것으로 나타났다. 다만 이란 현 정권이 유지된 상태로 전쟁을 끝내는 것에 대해서는 과반이 반대하는 것으로 조사됐다. 미국 방송 씨비에스뉴스와 여론조사기관 유,https://www.etnews.com/20260323000017,IT/과학,2026-03-24,"Mon, 23 Mar 2026 08:01:18 +0900",오늘의 인기기사 - 이티뉴스
"LG엔솔, “ESS·신사업 비중 40% 중반까지 확대”","LG에너지솔루션이 20일 오전 서울 LG트윈타워에서 최고경영자(CEO) 김동명 사장 및 주요 경영진, 주주 및 기관 투자자들이 참석한 가운데 '제6기 정기주주총회'를 개최했다. 김동명 사장은 “지금은 산업의 성장 가치가 재편되는 '밸류 시프트(Value Shift)'의",https://www.etnews.com/20260320000183,IT/과학,2026-03-24,"Fri, 20 Mar 2026 12:55:07 +0900",오늘의 인기기사 - 이티뉴스
[뉴스줌인] “사람 대신 AI” IT 계약 대전환…변화 기로에 선 '인건비 중심' 생태계,"전통적인 정보기술(IT) 서비스 시장의 계약 관행인 '인건비 중심 산정 체계'가 인공지능(AI) 기술의 혁신으로 전환기를 맞을 전망이다. 개발 효율을 비약적으로 높이는 AI 기술이 대형 프로젝트 현장에 실제 투입되기 시작하면서, 기술 도입에 따른 생산성 증가분과 그에",https://www.etnews.com/20260320000251,IT/과학,2026-03-24,"Sun, 22 Mar 2026 14:00:00 +0900",오늘의 인기기사 - 이티뉴스
"네이버, 남성복 '미스터' 접고 패션 영토 넓힌다",네이버가 남성 패션 큐레이션에 집중했던 '미스터(MR.)' 서비스를 접는다. 여성복과 신진 브랜드까지 아우르는 확장된 형태의 새로운 패션 플랫폼으로 대대적인 개편할 계획이다. 21일 업계에 따르면 네이버는 오는 31일 네이버쇼핑 내 '미스터' 서비스를 전격 종료한다.,https://www.etnews.com/20260320000208,IT/과학,2026-03-24,"Sat, 21 Mar 2026 06:00:00 +0900",오늘의 인기기사 - 이티뉴스
[속보] 코스피 급락에 매도 사이드카 발동,23일 국내 증시가 급락 출발하며 코스피 시장에 프로그램 매도 사이드카가 발동됐다.,https://www.etnews.com/20260323000048,IT/과학,2026-03-24,"Mon, 23 Mar 2026 09:23:51 +0900",오늘의 인기기사 - 이티뉴스
"차량 5부제 25일 시행…전기·수소차 제외, 민간 보류","중동발 에너지 수급 불안이 확산되면서 정부가 25일 0시부로 공공부문을 중심으로 '차량 5부제'를 전격 시행한다. 다만 민간에 대해서는 즉각적인 의무화 대신 자율 참여를 유도하고, 상황 악화 시 단계적으로 확대하는 '선별적 수요관리' 방식을 택했다. 기후에너지환경부는",https://www.etnews.com/20260324000163,AI/인공지능,2026-03-24,"Tue, 24 Mar 2026 11:18:18 +0900",오늘의 추천기사 - 이티뉴스
“골칫거리 화면 주름 해결하나”… 애플 '아이폰 폴드' 자가치유 유리 승부수,"애플의 첫 폴더블 아이폰의 출시가 늦어질 수 있다는 관측이 나오는 가운데, 화면 주름(크리즈) 문제를 해결할 새로운 기술 적용 가능성이 제기됐다. 최근 업계에서는 애플이 준비 중인 이른바 '아이폰 폴드'의 출시 시점이 예상보다 미뤄질 수 있다는 소문이 확산하고 있다.",https://www.etnews.com/20260324000135,AI/인공지능,2026-03-24,"Tue, 24 Mar 2026 10:43:43 +0900",오늘의 추천기사 - 이티뉴스
"美, 이란전쟁 종료시점 '4월 9일' 제시…파키스탄서 협상 추진 “전투·협상 병행”","도널드 트럼프 대통령이 이란 에너지 시설 공격을 닷새간 유예하겠다고 밝힌 가운데, 미국이 이란 전쟁 종식 목표 시점을 다음 달 9일로 설정했다는 보도가 나왔다. 그러나 이란은 미국과의 협상 자체를 전면 부인하며 양측 입장이 크게 엇갈리고 있다. 이스라엘 일간지 예디오트",https://www.etnews.com/20260324000134,AI/인공지능,2026-03-24,"Tue, 24 Mar 2026 10:41:01 +0900",오늘의 추천기사 - 이티뉴스
"인터엑스, 글로벌 표준 'AAS'의 새로운 실제 현장 적용 기준 제시","독일의 인더스트리 4.0에서 시작된 에셋 어드미니스트레이션 셀(AAS) 표준이 글로벌 제조 데이터 표준으로 자리 잡으면서, 국내에서도 ASS 표준에 참여 기업이 주목받고 있다. 제조 인공지능 전환(AX)·자율제조 전문기업 인터엑스(INTERX)는 AAS 기반 표준화 사",https://www.etnews.com/20260324000112,AI/인공지능,2026-03-24,"Tue, 24 Mar 2026 10:23:57 +0900",오늘의 추천기사 - 이티뉴스
"삼성전자·LG전자, 유럽 HVAC 패권 전쟁 점화…밀라노서 격돌","삼성전자와 LG전자가 유럽 최대 공조 전시회 'MCE 2026'에서 맞붙었다. 양 사는 24일(현지시간)부터 나흘간 이탈리아 밀라노에서 열리는 전시회에서 유럽 히트펌프 시장을 겨냥한 전략과 제품을 공개했다. 삼성전자는 인수한 플랙트그룹과 협업으로 중앙공조 경쟁력을, L",https://www.etnews.com/20260324000111,AI/인공지능,2026-03-24,"Tue, 24 Mar 2026 10:23:47 +0900",오늘의 추천기사 - 이티뉴스
"美 법원 “국방부, NYT에 출입증 돌려줘”… 펜타곤 “언론 사무실 폐쇄”","미국 법원의 국방부의 언론 취재 활동 제한에 제동을 걸자, 국방부가 기자 사무실을 폐쇄하겠다고 밝혔다. 23일(현지시간) AP 통신에 따르면 숀 파넬 국방부 대변인은 “미군 취재진이 사용해 온 국방부 내 '특파원 회랑'을 즉시 폐쇄한다”며 “취재진은 건물 밖에 있는 '",https://www.etnews.com/20260324000109,AI/인공지능,2026-03-24,"Tue, 24 Mar 2026 10:21:11 +0900",오늘의 추천기사 - 이티뉴스
"셀트리온, 1.2조원 베팅…'57만리터 체제'로 글로벌 바이오 '승부'","셀트리온이 1조2000억원을 투입해 한·미 생산기지를 동시 확장하며 글로벌 바이오 생산 경쟁력을 끌어올린다. 생산능력은 기존 31만6000리터(ℓ)에서 57만1000리터로 약 80% 늘리고, 원가 경쟁력까지 높이는 효과를 노린다. 차세대 바이오시밀러와 신약 생산까지 빠",https://www.etnews.com/20260324000101,AI/인공지능,2026-03-24,"Tue, 24 Mar 2026 10:09:57 +0900",오늘의 추천기사 - 이티뉴스
"대한항공, '부산-베이징' 운항 재개…중화권 4개 노선 최대 10% 할인",대한항공이 부산에서 출발하는 중화권 4개 노선을 대상으로 항공권 할인 프로모션을 시행한다. 프로모션 기간은 4월30일까지로 대상 노선은 부산발 상하이(푸동)·칭다오·베이징·타이베이 항공편이다. 대한항공 홈페이지와 모바일 애플리케이션(앱)에서 해당 노선 일반석·프레스티지,https://www.etnews.com/20260324000099,AI/인공지능,2026-03-24,"Tue, 24 Mar 2026 10:09:23 +0900",오늘의 추천기사 - 이티뉴스
"볼보, 차세대 전기 SUV 'EX90' 사전 계약…“XC90 T8 대비 1000만원 낮춰”",볼보자동차코리아가 차세대 전기 플래그십 스포츠유틸리티차(SUV) 'EX90' 사전 계약을 시작한다. 가격은 동급의 XC90 T8(플러그인하리브리드·PHEV) 대비 약 1000만원 낮췄다. 정확한 차량 정보와 가격은 4월1일 국내 출시와 동시에 공개된다. EX90은 볼보,https://www.etnews.com/20260324000090,AI/인공지능,2026-03-24,"Tue, 24 Mar 2026 10:01:30 +0900",오늘의 추천기사 - 이티뉴스
"美, WTO 개혁 요구…한국 개도국 지위 유지 지적",미국이 세계무역기구(WTO) 각료회의를 앞두고 고강도 개혁을 요구하는 보고서를 공개했다. 한국 등 4개국이 개발도상국 지위를 유지하고 있다고 문제를 제기했다. 미국 무역대표부(USTR)는 23일(현지시간) 홈페이지를 통해 작년 12월 발표한 초안에 바탕을 둔 WTO 개,https://www.etnews.com/20260324000074,AI/인공지능,2026-03-24,"Tue, 24 Mar 2026 09:48:46 +0900",오늘의 추천기사 - 이티뉴스
"정용진 회장, '스타필드 청라' 현장 점검…“韓 대표 랜드마크로”","정용진 신세계그룹 회장은 지난 23일 인천 청라국제도시에 조성하고 있는 '스타필드 청라' 건설 현장을 찾아 프로젝트 진행 상황을 직접 점검했다. '스타필드 청라'는 2만3000석 규모 멀티스타디움과 호텔, 인피니티풀, 쇼핑몰이 하나로 연결되는 세계 최초 초대형 복합 레",https://www.etnews.com/20260324000063,AI/인공지능,2026-03-24,"Tue, 24 Mar 2026 09:35:59 +0900",오늘의 추천기사 - 이티뉴스
"KB금융, 2026년 '20조원' 생산적 금융 가동…5년간 1조원 펀드 조성",KB금융그룹이 첨단전략산업 육성과 소상공인 지원을 위해 2026년 20조원 규모의 'KB국민행복 성장 프로젝트'를 추진하고 생산적 금융 실천을 본격화한다. KB금융은 지난 23일 서울 여의도 KB국민은행 신관에서 '제3차 그룹 생산적금융 협의회'를 개최하고 이 같은 내,https://www.etnews.com/20260324000062,AI/인공지능,2026-03-24,"Tue, 24 Mar 2026 09:35:42 +0900",오늘의 추천기사 - 이티뉴스
"“美와 대화 없었다” 이란군, 美·이스라엘 기지 공습…“F-35·F-15 전투기 주둔”",이란군이 이스라엘과 중동 내 미군 거점을 겨냥해 자폭 드론 공격을 감행했다고 주장하면서 긴장이 다시 고조되고 있다. 반면 미국은 이란과의 대화가 진행 중이라고 밝혀 양측 입장이 정면으로 엇갈리고 있다. 이란 국영방송 IRIB는 23일(현지시간) 이란군 성명을 인용해 “,https://www.etnews.com/20260324000039,AI/인공지능,2026-03-24,"Tue, 24 Mar 2026 09:14:24 +0900",오늘의 추천기사 - 이티뉴스
전동시트·연료·배선 결함…팰리세이드·카니발 등 40만대 리콜,"전동시트 오작동부터 연료 누유, 배선 손상까지 결함이 동시에 확인됐다. 차량 핵심 안전 부위 전반에서 문제가 드러나며 리콜 규모가 40만대를 넘어섰다. 국토교통부는 24일 현대자동차, 기아, 케이지모빌리티, BMW코리아가 제작·수입·판매한 24개 차종 40만8942대를",https://www.etnews.com/20260324000035,AI/인공지능,2026-03-24,"Tue, 24 Mar 2026 09:09:20 +0900",오늘의 추천기사 - 이티뉴스
구형 아이폰 수억대 해킹 위험…해킹툴 인터넷 공개됐다,수억 대에 달하는 구형 아이폰을 손쉽게 해킹할 수 있는 소프트웨어 도구가 온라인에 공개돼 악용 우려가 커지고 있다. 미국 정보기술 전문 매체 테크크런치 는 아이폰 해킹 도구인 다크소드 최신 버전이 최근 개발자 코드 공유 사이트 깃허브 에 공개됐다고 보도했다. 다크소드는,https://www.etnews.com/20260324000030,AI/인공지능,2026-03-24,"Tue, 24 Mar 2026 09:01:44 +0900",오늘의 추천기사 - 이티뉴스
"“수 천대 전기차를 하나의 전력 자원으로”…GIST, V2G 상용화 앞당길 '가상 배터리' 개발",수 천대의 전기자동차를 묶어 하나의 전력자원으로 사고 파는 '가상 배터리' 기술이 개발됐다. 전기차를 전력망과 연결해 활용하는 전기차-전력망 연계기술(V2G) 상용화를 앞당길 것으로 기대한다. 광주과학기술원(GIST·총장 임기철)은 김윤수 전기전자컴퓨터공학과 교수팀이,https://www.etnews.com/20260324000023,AI/인공지능,2026-03-24,"Tue, 24 Mar 2026 08:47:19 +0900",오늘의 추천기사 - 이티뉴스
"웹케시, '금융 AI 에이전트 컨퍼런스' 개최…“상용화 단계 기술 공개”",웹케시는 오는 4월 23일 서울 여의도FKI 타워 그랜드볼룸에서 '웹케시 금융 AI 에이전트 컨퍼런스 2026'을 개최한다고 24일 밝혔다. 이번 행사는 단순 기술 발표를 넘어 '금융 인공지능(AI) 에이전트 전문 기업'으로서의 시장 내 입지를 강화하는 자리이다. 웹케,https://www.etnews.com/20260324000017,AI/인공지능,2026-03-24,"Tue, 24 Mar 2026 08:24:34 +0900",오늘의 추천기사 - 이티뉴스
중동 막히자 LNG 사러 미국으로 몰린다…이란전에 웃는 美 가스 업체,이란이 사실상 호르무즈 해협을 봉쇄하면서 아시아 국가들의 에너지 수급에 차질이 발생하자 미국 액화천연가스(LNG) 수출업체들이 전쟁의 최대 수혜자로 떠오르고 있다는 분석이 나왔다. 미국 일간지 워싱턴포스트는 23일 이란 전쟁에서 적어도 하나의 승자가 등장했다며 미국 천,https://www.etnews.com/20260324000014,AI/인공지능,2026-03-24,"Tue, 24 Mar 2026 08:20:24 +0900",오늘의 추천기사 - 이티뉴스
여객기 착륙하다 소방차와 충돌…뉴욕 라과디아공항 전면 마비,미국 뉴욕의 라과디아 공항 활주로에서 여객기가 소방차와 충돌하는 사고가 발생해 공항 운영이 전면 중단됐다. 미국 연방항공청 에 따르면 캐나다 몬트리올에서 출발한 에어캐나다 익스프레스 소속 봄바디어 시아르제이 구백 여객기가 22일(현지시간) 밤 11시 45분께 라과디아,https://www.etnews.com/20260324000013,AI/인공지능,2026-03-24,"Tue, 24 Mar 2026 08:04:29 +0900",오늘의 추천기사 - 이티뉴스
